{
  "$schema": "./baseline-cases.schema.json",
  "schemaVersion": "1.0.0",
  "manifestId": "distinctive-ui-modernization-baseline-cases",
  "fixedContext": {
    "locale": "en-IN",
    "timeZone": "UTC",
    "clockInstant": "2026-01-05T10:30:00Z",
    "currency": "INR",
    "dateInputPattern": "dd/MM/yyyy",
    "dateApiPattern": "yyyy-MM-dd"
  },
  "roles": [
    { "id": "ROLE-ANONYMOUS", "label": "Anonymous" },
    { "id": "ROLE-ERP-ADMIN", "label": "ERP Administrator" }
  ],
  "accountStates": [
    { "id": "ACCOUNT-SIGNED-OUT", "authenticated": false, "sessionState": "none", "permissions": ["login"] },
    { "id": "ACCOUNT-ADMIN-ACTIVE", "authenticated": true, "sessionState": "valid", "permissions": ["home", "reports", "customers", "payments", "orders", "products", "cost-breakdown", "notifications", "settings"] }
  ],
  "conditionFixtures": [
    { "id": "DEVICE-PIXEL-7-BASELINE", "kind": "device", "values": { "manufacturer": "Google", "model": "Pixel 7", "abi": "arm64-v8a", "widthDp": 412, "heightDp": 892, "densityDpi": 420, "refreshRateHz": 60 } },
    { "id": "OS-ANDROID-14-API-34", "kind": "os", "values": { "name": "Android", "version": "14", "apiLevel": 34, "securityPatch": "2026-01-01" } },
    { "id": "BUILD-PROD-RELEASE", "kind": "build", "values": { "buildType": "release", "flavor": "prod", "debuggable": false, "minifyEnabled": true, "baselineArtifactLabel": "latest-accepted-production-equivalent", "candidateArtifactLabel": "migration-increment-under-test" } },
    { "id": "DATA-ERP-FIXED-2026-01-05", "kind": "data", "values": { "fixtureVersion": "1.0.0", "recordClock": "2026-01-05T10:30:00Z", "inputFixtureIds": ["INPUT-LOGIN", "INPUT-HOME", "INPUT-REPORTS", "INPUT-TANK", "INPUT-SALES", "INPUT-CUSTOMER", "INPUT-PAYMENT", "INPUT-ORDER", "INPUT-PRODUCT", "INPUT-COST-BREAKDOWN", "INPUT-PROFORMA", "INPUT-NOTIFICATION", "INPUT-SETTINGS", "INPUT-MODAL", "INPUT-DATE"] } },
    { "id": "NETWORK-WIFI-STABLE", "kind": "network", "values": { "transport": "wifi", "online": true, "validated": true, "downstreamKbps": 50000, "upstreamKbps": 10000, "latencyMs": 20, "packetLossPercent": 0 } },
    { "id": "POWER-BATTERY-75-NORMAL", "kind": "power", "values": { "source": "battery", "levelPercent": 75, "batterySaver": false, "performanceMode": "normal" } },
    { "id": "THERMAL-NONE-STABLE", "kind": "thermal", "values": { "status": "none", "deviceTemperatureC": 30, "cooldownMinutesBeforeRun": 10 } },
    { "id": "ANIMATION-SYSTEM-1X", "kind": "animation", "values": { "windowScale": 1, "transitionScale": 1, "animatorScale": 1, "reducedMotion": false } }
  ],
  "conditionSets": [
    { "id": "CONDITIONS-BASELINE-CONTROLLED", "conditionRefs": { "device": "DEVICE-PIXEL-7-BASELINE", "os": "OS-ANDROID-14-API-34", "build": "BUILD-PROD-RELEASE", "data": "DATA-ERP-FIXED-2026-01-05", "network": "NETWORK-WIFI-STABLE", "power": "POWER-BATTERY-75-NORMAL", "thermal": "THERMAL-NONE-STABLE", "animation": "ANIMATION-SYSTEM-1X" } }
  ],
  "inputFixtures": [
    { "id": "INPUT-LOGIN", "values": { "usernameEntered": "  ADMIN@BASEOILS.COM  ", "usernameSubmitted": "admin@baseoils.com", "passwordEntered": "Admin@123", "passwordSubmitted": "Admin@123", "rememberMe": true, "invalidUsername": "admin@", "shortPassword": "ab" } },
    { "id": "INPUT-HOME", "values": { "greetingName": "Asha Rao", "monthlySalesCount": 128, "monthlySalesAmount": "1234567.89", "outstandingAmount": "245600.50", "lowStockCount": 7, "selectedTab": "home" } },
    { "id": "INPUT-REPORTS", "values": { "selectedTab": "reports", "menu": "Sales Reports", "reportKey": "sales_summary", "searchQuery": "premium", "fromDate": "01/01/2026", "toDate": "05/01/2026", "groupBy": "Daily" } },
    { "id": "INPUT-TANK", "values": { "tankId": 11, "tankCode": "TK-01", "product": "SN 500 Base Oil", "capacityLiters": "50000.0", "stockLiters": "32750.5", "fillPercent": "65.501", "uom": "L" } },
    { "id": "INPUT-SALES", "values": { "fromDate": "01/01/2026", "toDate": "05/01/2026", "apiFromDate": "2026-01-01", "apiToDate": "2026-01-05", "invoiceCount": 42, "quantityLiters": "12600.0", "taxableAmount": "1234567.89", "taxAmount": "222222.22", "totalAmount": "1456790.11" } },
    { "id": "INPUT-CUSTOMER", "values": { "customerId": 501, "code": "CUS-0501", "name": "Shree Auto Parts", "searchQuery": "Shree", "phone": "+919876543210", "invoiceId": 7001, "invoiceDebit": "50000.00", "outstanding": "75000.00", "paymentAmount": "25000.50", "paymentDate": "05/01/2026", "paymentMode": "NEFT", "reference": "UTR20260105001", "remarks": "Part payment for INV-7001" } },
    { "id": "INPUT-PAYMENT", "values": { "invoiceId": 7001, "amountEntered": "25000.509x", "amountSanitized": "25000.50", "paymentMode": "NEFT", "paymentDateDisplay": "05/01/2026", "paymentDateApi": "2026-01-05", "reference": "UTR20260105001", "remarks": "Part payment for INV-7001", "overdueOnly": true } },
    { "id": "INPUT-ORDER", "values": { "pendingOrderId": 8101, "pendingOrderNumber": "SO-2026-8101", "invoiceId": 9101, "invoiceNumber": "INV-2026-9101", "customer": "Shree Auto Parts", "amount": "118000.00", "fromDate": "01/01/2026", "toDate": "05/01/2026" } },
    { "id": "INPUT-PRODUCT", "values": { "selectedTab": "cost-breakdown", "skuId": 301, "skuCode": "ENG-15W40-210", "skuName": "Premium 15W-40 210 L", "family": "Engine Oil", "grade": "15W-40", "sheetId": 601 } },
    { "id": "INPUT-COST-BREAKDOWN", "values": { "sheetId": 601, "skuId": 301, "family": "Engine Oil", "grade": "15W-40", "effectiveFromDisplay": "05/01/2026", "effectiveFromApi": "2026-01-05", "effectiveToDisplay": "31/01/2026", "effectiveToApi": "2026-01-31", "remarks": "January controlled baseline", "lines": [{ "rawMaterialId": 101, "code": "RM-BASE-500", "name": "SN 500 Base Oil", "uom": "L", "isBaseOil": true, "quantity": "150.0", "rate": "90.0", "amount": "13500.0" }, { "rawMaterialId": 102, "code": "RM-ADD-01", "name": "Additive Package", "uom": "L", "isBaseOil": false, "quantity": "60.0", "rate": "210.0", "amount": "12600.0" }], "packageCost": "6", "margin": "4", "transportCost": "2" } },
    { "id": "INPUT-PROFORMA", "values": { "invoiceId": 9201, "customerId": 501, "proformaNumber": "PI-2026-9201", "proformaDate": "2026-01-05", "validUntilDate": "2026-01-19", "remarks": "Deliver in two lots", "termsAndConditions": "Payment due within 15 days", "line": { "deliveryType": "Drum", "productGradeId": 41, "productSKUId": 301, "hsnCode": "27101980", "quantity": 10, "unitPrice": "1000.0", "taxRate": "18.0", "discountPercent": "0.0" } } },
    { "id": "INPUT-NOTIFICATION", "values": { "unreadCount": 3, "selectedTypes": ["Warning"], "notificationId": 4001, "title": "Low stock alert", "type": "Warning", "readBefore": false, "readAfter": true } },
    { "id": "INPUT-SETTINGS", "values": { "profileName": "Asha Rao", "email": "asha.rao@example.invalid", "branchId": 12, "rolesText": "Admin, Manager", "themeBefore": "SYSTEM", "themeSelected": "DARK", "cacheContainsProfile": true } },
    { "id": "INPUT-MODAL", "values": { "open": true, "confirmLabel": "Confirm", "dismissLabel": "Cancel", "launcher": "row-action", "recordId": "601" } },
    { "id": "INPUT-DATE", "values": { "initialDate": "01/01/2026", "selectedDate": "05/01/2026", "apiEquivalent": "2026-01-05", "dismissedDate": "01/01/2026" } },
    { "id": "INPUT-NAVIGATION", "values": { "gateAuthenticatedDestination": "home", "gateSignedOutDestination": "login", "selectedTopLevel": "home", "nextTopLevel": "reports" } }
  ],
  "outcomeProfiles": [
    { "id": "OUTCOME-NAV-GATE", "displayedValues": { "signedOutDestination": "login", "authenticatedDestination": "home" }, "submittedValues": {}, "calculations": {}, "validation": { "accepted": ["valid session", "no session"], "rejected": [], "messages": {} }, "navigation": { "destination": "login when signed out; home when authenticated", "modalOutcome": "none", "visibleBack": "not available on gate", "systemBack": "platform exits from top-level destination", "topLevelBack": "unchanged" } },
    { "id": "OUTCOME-NAV-PRIMARY", "displayedValues": { "destinations": ["Home", "Reports", "Alerts"], "selected": "Home" }, "submittedValues": {}, "calculations": {}, "validation": { "accepted": ["authorized destination selection"], "rejected": ["unauthorized direct destination"], "messages": {} }, "navigation": { "destination": "selected authorized top-level destination", "modalOutcome": "open modal is dismissed first", "visibleBack": "same as baseline stack", "systemBack": "same as baseline stack", "topLevelBack": "same as baseline top-level behavior" } },
    { "id": "OUTCOME-LOGIN", "displayedValues": { "username": "  ADMIN@BASEOILS.COM  ", "passwordMask": "•••••••••", "rememberMe": true, "invalidUsernameMessage": "Enter a valid email address", "shortPasswordMessage": "Password must be at least 3 characters" }, "submittedValues": { "username": "admin@baseoils.com", "password": "Admin@123", "rememberMe": true }, "calculations": { "identityNormalization": "trim then lowercase email" }, "validation": { "accepted": ["admin@baseoils.com", "+919876543210", "Admin@123"], "rejected": ["admin@", "ab", "blank username", "blank password"], "messages": { "blankUsername": "Email or phone is required", "invalidEmail": "Enter a valid email address", "invalidPhone": "Enter a valid phone number", "blankPassword": "Password is required", "shortPassword": "Password must be at least 3 characters", "form": "Please correct highlighted fields" } }, "navigation": { "destination": "home after NavigateToHome", "modalOutcome": "none", "visibleBack": "not available after login replaces login", "systemBack": "does not return to login after success", "topLevelBack": "exits home according to baseline" } },